TITLE,URL,Success_Abstract
Telefónica Telecommunications (Argentina): Enhancing Customer Experience in Software Quality Assurance,https://www.getronics.com/telefonica-telecommunications-movistar-argentina-agile-transformation/,"A recent collaboration with Getronics significantly improved the quality and reliability of the mobile app experience for one of the country’s leading telecommunications companies. Partnering with one of the largest telecommunications companies in Argentina, Getronics contributes to the continuous innovation of the client’s mobile app, implementing quality assurance services with agile methodologies. Telefónica Telecommunications, S. A. is a Spanish multinational telecommunications company headquartered in Madrid. It is the fourth-largest telecommunications company in Europe and the thirteenth worldwide. In Argentina, Movistar, the brand representing Telefónica, has over 11,000 employees and more than 16 million users. The Challenge Movistar Argentina needed to implement a new service adopting agile methodologies with innovative, faster, and more effective solutions for its users to ensure the functionality of its platforms. The goal was to implement a Testing Factory & QA service, covering compatibility, accessibility, performance, automation, and UX/UI testing, with a service model based on indicators and KPIs. Getronics presented a superior proposal that met the high industry standards required by the client. With proven experience in the telecommunications market, and extensive business knowledge, we supported Movistar Argentina in meeting this new challenge. The Solution Getronics acted as a key partner, working closely with the Movistar Argentina team to raise the quality standards of the mobile app. From the start, our approach was collaborative and results-oriented. We implemented a comprehensive set of functional and non-functional tests which were designed to ensure the reliability of performance on their mobile app, Mi Movistar. This process included new testing standards and procedures, which gave complete coverage at every stage of development. We created a collaborative space known as the Certification Discipline. Here, we worked closely to strengthen and improve software certification practices. As needs and challenges evolved, we expanded this space to include new agile teams. We applied specialised procedures in compatibility, accessibility, performance, automation, and user experience (UX/UI) testing, among other critical research areas. Key Results After the changes were made, Movistar Argentina reported significant results in terms of quality: Early Deliveries: The first MVP with the new software architecture was achieved in just 3 months. Improved Product Quality: We detected and resolved over 2,000 code defects in certification environments. We executed over 3,500 automated regressions, saving more than 3,100 hours in manual testing time. We improved accessibility with over 40,000 test cases. Expansion of Agile Culture: Since 2020, the service has been growing steadily, with a current average of 11,000 hours of execution per month. Creation of the Certification Discipline group, defining processes for functional, non-functional, and automated testing. Top 1 Telecommunications App in the Market: In partnership with the Movistar team, we improved the NPS (Net Promoter Score) in the Android and iOS stores. Alliance with Getronics as a Strategic Technology Partner, with over 20 years of collaboration. At Getronics, we will continue to refine and professionalise the Certification Discipline while continuing to innovate to contribute to Movistar’s ongoing success, with a focus on user experience. We are committed to creating long-term value, which is sustainable, innovative, and profitable. * In software development, “regression” refers to re-executing previous tests to ensure recent changes have not introduced new errors. This process is essential to maintain the quality and stability of the software, and automating these tests saves time and resources, ensuring continuous delivery of solutions without compromising existing functionality."
"The Council of Justice, Andalusia (Spain) relies on Getronics for ICT project management",https://www.getronics.com/the-council-of-justice-andalusia-spain-relies-on-getronics-for-ict-project-management/,"The Council of Justice, Local Administration, and Public Function of Andalusia is responsible for managing public sector competences in the Spanish region. It encompasses a wide range of services and projects related to information systems. They now rely on Getronics for optimising their ICT project management. The Council of Justice faced the challenge of improving the control and monitoring of its information systems development projects. To address this need, it issued a tender to hire the best professional services required to help the Council achieve its objectives. In this process, Getronics was found to be the highest-rated company and was awarded the contract. The client encountered difficulties in adequately controlling and supervising the execution of information systems development projects, as well as ensuring their quality in compliance with the region’s regulations. Getronics proposed implementing an ICT project management framework for software development tailored to the Council’s specific needs. This included a service delivery model through a comprehensive catalogue covering the entire project lifecycle, from development to maintenance of information systems. Additionally, management tools such as Redmine for project management and JIRA for quality assurance were added. Undoubtedly, this project was not without risks. Getronics faced significant challenges, including managing an extensive and diverse portfolio of projects in an organisational environment, which were not traditionally oriented towards project management or compliance with existing constraints on ICT projects. Benefits The solution proposed by Getronics enabled the Council to achieve effective control of its projects, meeting defined indicators, and reaching established objectives. Key benefits included the establishment of development standards, the implementation of project and quality management tools, and the automation of the software delivery lifecycle. These improvements resulted in greater efficiency, speed, and quality of projects. Getronics facilitated the work of Council staff and improved the quality of service provided to citizens. “It has been a pleasure to collaborate with Getronics. We have managed to establish a solid project management framework that has allowed us to improve our operational efficiency and meet the quality standards required by our organisation and current regulations.” Daniel González Valencia – Head of Sectoral Information Systems Service, Digital Agency of Andalusia. What can Getronics do for you? We are committed to delivering exceptional customer service, to enable your business to focus on your core strengths while entrusting your IT needs to Getronics. Getronics is a global leader in technology solutions with a team of over 4,000 colleagues in 22 centres, providing comprehensive end-to-end services across the globe. Browse our services and discover which is right for your business. You can organise a call-back from our team to talk with one of our experts."
Getronics Transforms Electronic Signature Services for RedIRIS,https://www.getronics.com/getronics-transforms-electronic-signature-services-for-rediris/,"The deployment of an electronic signature validation system, @firma, in addition to that offered by the Ministry of Digital Transformation and Public Function, allows RedIRIS to offer a more stable and efficient service to its 500 associated institutions. A New Requirement RedIRIS is the Spanish academic and research network providing advanced communication services to the national scientific and university community. It is managed directly by the Public Business Entity Red. es and funded by the Ministry of Science, Innovation, and Universities. With over 500 affiliated institutions (mostly universities and research centres), RedIRIS, through its collaboration with Crue Digitalisation, identified the need to complement the @firma service provided by the General Secretariat of Digital Administration (SGAD) of the Ministry of Digital Transformation and Public Function with a federated @firma service. This would ensure that all institutions affiliated with RedIRIS have additional access to the @firma service, which is critical for the various e-administration processes that these institutions must constantly carry out. RedIRIS needed to implement a technical infrastructure and services to meet the technological, operational, continuity, and demand needs of this service for potential users. Additionally, it required specialised support services to administer, maintain, operate, and manage the @firma electronic signature validation platform and address queries and incidents related to that platform. A Scalable Solution Getronics proposed the implementation of a scalable infrastructure solution with a cluster for managing the @firma platform. This platform included high-level security and traffic control components to handle the volume of required requests. Furthermore, a Business Intelligence (BI) solution was proposed for data exploitation, allowing proactive decision-making processes and enabling the service to adapt to fluctuations in demand. This platform also met the following key objectives for the project’s success: Integrate all information into a single analytical platform for generating customised and on-demand reports. Create a web-based dashboard generation system to enable service management to analyse service metrics and extract useful information. Ensure the platform was “self-service” so that decision-makers could generate their own reports in real-time and on-demand, without relying on IT teams. Facilitate advanced analytics to shift from reaction to anticipation, thanks to the application of Machine Learning, thus obtaining predictive models that allow managing infrastructure capacity based on available historical information. Include indicator categories such as data quality and business, such as the degree of service usage/penetration. Of course, the project was not without challenges. Coordination between different work teams was crucial to implementing the platform, including the provision of infrastructure, technical support, application development, and data analytics. Additionally, integration with the client’s systems and connections with their security and traffic systems was one of the biggest challenges for the Getronics teams. The Achieved Benefits The new electronic signature platform adds value to users compared to solely relying on the SGAD service, with which this additional deployment has been coordinated. They now have a maintenance service for platform management, incident, and problem management. Moreover, the maintenance plan is proactive through the analysis of patches, updates of new versions, capacity planning, and anticipation of problem detection. They have support services for the integration of affiliated systems with the @firma platform, including service requests and technical/functional advice. The Business Intelligence platform allows analysing platform information, with a view to improving system understanding and thus anticipating future problems. This successful collaboration between RedIRIS and Getronics resulted in the establishment of a robust electronic signature validation platform tailored to the needs of RedIRIS-affiliated institutions, ensuring higher quality, reliability, and efficiency of the service. “This project has been a complete success due to our experience in implementing similar solutions for other clients. Currently, Getronics provides operation, administration, and support services for the second largest implementation of @firma after SGAD, and the first federated platform in terms of service provision volume. This makes us well-acquainted with the solution and able to offer the best option to each administration or company” Federico Real, Service Delivery Manager at Getronics"
Repetco has partnered with Getronics for the commissioning of its new recycling plant,https://www.getronics.com/repetco-and-getronics-transforming-multilayer-plastic-recycling-with-innovation-and-technology/,"Repetco is a Spanish company that has developed a state-of-the-art factory for recycling food-grade plastic packaging and has relied on Getronics as its preferred technological partner in the commissioning of its plant in Albacete. The project presented the enormous challenge of not only starting up a factory but also establishing a company from scratch for plastic recycling. With this initiative, Repetco is changing the ecosystem of plastic recycling and promoting a sustainable and clean circular economy. Thanks to cutting-edge technology, it manages to recycle food-grade PET packaging, giving a second life to plastics that were previously very challenging to process. Through its process, food-grade PET packaging can be reused in the food industry, such as in trays or bottles, as well as in other industries like textiles, automotive, etc. The setup of this new plant has been a 360-degree project involving research and development, engineering, and digitalization consulting, with a complex process. Repetco relied on Getronics for various levels of service. From a technological perspective, the main challenge has been the complete digitalization of a new plant and its newly defined processes. Getronics has handled integration engineering, commissioning, operation, maintenance, and support for all existing solutions. The tasks in which the Getronics team participated include: Systems consultancy Consultancy during the product definition phase, from the SCADA system to communication protocols, global information systems consultancy at both operational (OT) and informational (IT) levels, specifications of different levels, and global system integration, among others. Implementation of plant systems and their integration with ERP management. Product Lifecycle Management (PLM): Manufacturing system management software, allowing all plant designs and generated documentation to have traceability. Manufacturing Execution System (MES): A system that deals with production control and planning, including a control reporting system. Development of the SCADA system A system with two control zones in the factory buildings, controlling plant production with real-time management of up to 24,000 data points and a control room in the offices. The system also serves for forensic analysis in case of failure. Production and auxiliary processes From scale systems for weighing raw materials with real-time integration of their operation to plastic identification and selection processes with optical readers, and controls of machinery for plastic washing, lamination, and shredding. Among the auxiliary processes, Getronics has taken charge, for example, of energy management (Natural Gas station and photovoltaic plant). Repetco has achieved the commissioning of this project with Getronics as the sole intermediary between OT and IT systems, leading the engineering and process areas, acting as a technological integrator for the digitalization process (MES, SAP, cybersecurity, communications, PLC…), ultimately becoming a true 360° technological partner, able to meet all the technological needs of the new plant, unifying materials, facilitating management, and reducing errors. “This project has allowed us to delve into the services and processes we offer at Getronics. We are very satisfied with the development of all phases since it has allowed us to demonstrate the broad spectrum of services and capabilities we can achieve, expanding different business areas.” Francisco Galisteo González, Head of Scada & IT/OT at Getronics."
Getronics Drives Unified Health Information System at Grupo Hospitales Parque,https://www.getronics.com/getronics-drives-unified-health-information-system-at-grupo-hospitales-parque/,"Getronics supports the Grupo Hospitales Parque, belonging to Caser Grupo Helvetia, in the unification of their Health Information System (HIS) into a single system in order to improve patient care. The goal was to achieve a unified and integrated system that would allow for continued growth, more agile decision-making, and improved outcomes. Grupo Hospitales Parque is a national hospital group established in 2012 with a philosophy of excellence in healthcare and service quality. Over the years, they have gradually incorporated renowned hospital centers in their region, some with over 40 years of experience. Currently, they are a leading hospital group in the areas where they operate (Mallorca, Canary Islands, Extremadura, and Castilla-La Mancha), experiencing strong and consistent growth, with various centers located across the country. The Challenge With the hospital group’s projected growth, there was an opportunity to invest in new technology to improve efficiency and provide higher-quality service by consolidating all the Hospital Information Systems (HIS) under a new corporate HIS called Sfere. The Solution Getronics proposed implementing Sfere as the corporate HIS for all the hospital centers within the group. This was achieved through a centralized installation with the appropriate structure and functionality to enable unified and distributed data configuration within the same setup. This approach provided the necessary flexibility to have: Unified entities, catalogs, and general processes, including patients’ medical records. Specific processes and configurations tailored to the needs of each center. The Sfere system was first implemented in the Canary Islands centers (Tenerife, Fuerteventura, and Lanzarote) before being extended to the rest of the centers. Additionally, as a provider of a comprehensive solution, the implementation of third-party systems (Navision for logistics management, OGS for patient guidance) was carried out, all integrated with the Sfere solution. Thanks to the collaboration, teamwork, and good understanding between Getronics and Hospitales Parque, the project was successfully implemented, resulting in a unique, accessible, and responsive information system that meets their needs. Benefits achieved after implementing Sfere Improved healthcare and administrative processes, leading to better cost control, billing accuracy, and quality of care. Access to an integrated global system with the necessary infrastructure, technical capacity, and functionality to facilitate growth and the addition of additional features and integrations with other global and specific applications. Recoding and unification of the group’s catalogs as a basis for comprehensive data analysis, enabling informed decision-making. Reduced costs and improved performance in overall system maintenance. Exponential improvement in time and outcomes (and consequently, satisfaction) during the implementation of new hospital centers within the group, utilizing existing components of the platform and facilitating global integration."
INSEAD: Transforming to a digital-first learning model,https://www.getronics.com/insead-digital-transformation-learning-model/,"When the pandemic hit, the international business school INSEAD had to rapidly change its technology, processes, and culture to deliver courses online. The pandemic provided a unique opportunity for the digital transformation of its IT systems and to develop new, data-driven solutions. Customer problem INSEAD is one of the world’s leading and largest graduate business schools. With campuses in four regions and more than 66,000 alumni distributed across 180 countries, the school is supporting tens of thousands of faculty, staff, students, and alumni. Like all education providers, INSEAD was required to re-invent, modify, and adapt its digital strategy during the COVID-19 pandemic. Almost overnight, INSEAD established a shift to an online delivery model, delivering all programmes, interactions, and assessments digitally. Staff transitioned immediately to working from home, putting pressure on existing systems, software, and hardware. Rapidly shifting to an online model highlighted severe shortcomings in INSEAD’s existing digital technology and processes – and demanded urgent action. Inspiring online learners INSEAD engaged Getronics to provide an end-to-end solution, including new technology, service-desk support, and seamless implementation. The crucial challenge was to deliver a rich and rewarding learning experience entirely online. The solution focussed on three key pillars: technology, processes, and people. During the pandemic, INSEAD introduced several cutting-edge technologies to help enhance the user experience, improve collaboration, and provide a group learning experience. To replicate the in-person experience, INSEAD developed new hybrid and virtual teaching models. Students could access virtual reality environments, bringing together people, cultures, and ideas through immersive experiences wherever they were in the world. Always-on support for staff When INSEAD made the shift from traditional IT to virtual access, it brought about a rapid culture change that their staff had to adapt to. To make this move smoother, it was essential to provide them with full support through easily accessible channels. INSEAD staff working remotely could access service desk agents provided endpoint management and remote troubleshooting. Microsoft Teams chat provided a convenient, always-on solution for staff. To support the transition, INSEAD staff could access live webinars to help them understand and effectively use remote working technologies. This was instrumental in introducing new ways of working to INSEAD’s teams. Access to a growing repository of guidance and support from experienced agents gave staff the confidence and capability to transition to an online-first approach. Technology & Solution INSEAD has modernised its entire digital solution. The business has introduced a Level 1.5 Global Service Desk, a Level 1.5 On-site IT and AV Support for its Asia Campus, and Level 2 Global Infrastructure Support. Data is at the heart of INSEAD’s strategy, with the information enabling the business to drive operational excellence and improve processes. Today, the school can access data that are descriptive, diagnostic, predictive, and prescriptive. This data drives better decisions, improves the learner experience, and boosts business performance. Getronics is proud to have partnered with INSEAD, helping the school achieve a successful digital transition during a global pandemic. In addition, we are exploring how Getronics’ expertise in AI and our SysTrack monitoring solution can supercharge the employee experience."
