TITLE,URL,Success_Abstract
Transforming MEZ Group digital fabric,https://www.getronics.com/transforming-mez-group-digital-fabric-cloud-platform/,"A new cloud computing solution has transformed MEZ Group operations. Replacing outdated software and systems with a new integrated cloud platform has optimised operations and supercharged security. The cloud has changed MEZ’s digital fabric, providing a foundation for business growth. Outdated systems MEZ Group has customers worldwide for its high-quality yarns and craft accessories. The business had enjoyed substantial online growth but struggled with old technology and software. Limitations caused by legacy platforms meant the company found itself unable to deal with rapidly changing customer demands. More worryingly, such systems weren’t secure, leaving the business at risk of attack. Business leaders understood the critical importance of digital infrastructure to expansion. While customer data always remained protected, the MEZ Group leadership team was aware of emerging threats and wanted to increase protection for the future. The solution was a shift from legacy systems to an integrated cloud solution. Migrating to the cloud The project began by analysing MEZ Group requirements, strategy, and existing software and hardware to identify a suitable solution. Working with the in-house digital team, we defined deliverables and developed a digital road map. Microsoft Azure was agreed upon as the most suitable cloud platform for security and scalability. “Our previous, on-premise infrastructure was very inflexible. Due to the seasonal nature of the fashion industry, the ability to scale up or down to meet rapidly changing demand was crucial to our success. Therefore, the additional flexibility provided by the Azure cloud platform is a huge benefit.” Claudia, Gebhart – Head of IT, MEZ Group MEZ Group transitioned to a consumption-based pricing plan, where the business only pays for the services and capacity used. This has delivered tremendous cost savings while providing greater transparency and predictability. As a result, the business has experienced cost savings of 50% – which is having a significant impact on the business’s profitability in an increasingly challenging market. Tailor-made Solutions: IT-as-a-Service Cloud solutions enable the customisation of services and software for each user. MEZ Group now uses a persona-based consumption model, where staff has access to the software they need to perform their roles. This IT-as-a-service approach has considerably impacted cutting operating costs and increased security. Light users, for example, may only have access to basic licenses and small amounts of support. Standard users may have their own computers and access to a much wider range of software. Introducing a persona-based IT-as-a-Service model enables MEZ Group to make the most efficient use of resources. Licenses are only produced and paid for those staff that need them. In the first three months alone, this helped the business to cut licensing costs by 20%. Operating an IT-as-a-service model gives the MEZ Group total control over which users have access to software, systems, and data. In addition, tiered access provides peace of mind and protection for all customer data, ensuring only those who need access to it have it. Building a secure system MEZ Groups machines, software, and systems have all been updated. Advanced endpoint protection, device monitoring, and patch management provide confidence that systems remain secure. To support the roll-out of the cloud, clear governance rules were developed to limit access to sensitive data. The business benefits from more robust data reporting and compliance standards. These add extra levels of protection for information, systems, and staff. Leaders can be confident that they have the highest protection from digital dangers and online threats. Redesigning the digital fabric of a business? Digital transformation is an ongoing process – and we’re proud to partner with MEZ Group for the long term. Together, we have completely redesigned the digital fabric of the business, providing a secure foundation for growth. As well as supercharging security, our digital solutions deliver significant savings – giving MEZ Group the confidence to invest for the future. “Working in partnership with Getronics, we have reshaped the company’s IT services, accessing new benefits around cost, security, and efficiency. Now, we have confidence that our entire business is ready for the journey ahead.” Claudia, Gebhart – Head of IT, MEZ Group"
Clínica de Girona: unified communications to transform patient care,https://www.getronics.com/clinica-de-girona-unified-communications-to-transform-patient-care/,"Getronics is working with Spanish healthcare provider Clínica de Girona to introduce innovative new technology to its new hospital. The unified communications system is transforming care and improving patient outcomes. Download this case study in PDF (English) Clínica de Girona is one of Spain’s most respected surgical and medical healthcare providers. Founded in 1934, the Clínica de Girona has invested in a new state-of-the-art hospital that’s three times larger than the building it replaces. The new Girona Clinic offers incredible facilities for patients, including: ?120 in-patient beds ?eight intelligent, high-definition operating rooms ?three delivery rooms and three for endoscopy?eight boxes in the intensive care unit (ICU) and ten emergency boxes ?a day hospital areaoncology, and pain medicine, with 20 individual boxes?a minor outpatient surgery room ?hemodialysis rooms Behind the scenes, patients are supported by various services, including permanent diagnostic imaging, clinical analysis, and pathological anatomy services. A comprehensive communication system Designing the new building has been a great challenge but presents a unique opportunity for Clínica de Girona to modernise its communication systems – and they selected Getronics as their partner. Clínica de Girona wanted to move from disparate communication systems to a comprehensive solution. Within the new facility, innovative IP-based communications were needed to streamline hospital processes and improve clinical diagnosis and treatment. The key is providing clinicians with the right information at the right time, empowering them to make the best decisions for every patient. What Getronics did 1. Communications that power clinical decision-making In the bustling Clínica de Girona hospital, agency staff and external contractors work alongside employees, sharing information and insights to improve diagnosis and treatment. Clinicians at Clínica de Girona use a range of tools, technologies, and communication systems to deliver patient care, but the existing system was slow and inefficient. The challenge for Getronics was to develop an integrated communications platform that maintains an individual’s operation freedom but integrates them into the core system. Getronics’ solution was to introduce a state-of-the-art telephony platform, the NEC SV9500, to power communication and collaboration. The platform integrates the management and automation of hospital processes, providing essential information to clinicians when needed. The new solution transforms a confusing tangle of hardware devices and cables into an easily accessible software application. The system is scalable, making it easy to add functionality and integrate new systems and services. We call it liquid telephony, and it’s at the heart of transforming patient care at Clínica de Girona. 2. Unified communications throughout the clinic Clinicians use standard processes when treating patients, but detailed information which was spread across various systems. Getronics’ solution was to unify communications processes, giving instant access to those in the clinic. Clinicians can now access crucial data on processes in a single place. The system covers all critical communication processes, including patient care and nursing. Access to protocols ensures that procedures are followed in a medical emergency, such as a stroke, heart attack or a patient requiring CPR. Clinicians aren’t stuck to a desk but need information on the move. So, we built the platform using wireless IP DECT technology. As well as enabling clinicians to access the information they need wherever they are, installation costs are lower when compared to traditional systems. 3. Robust security Any system failure could threaten patients’ lives, so we built on the strongest foundations. As a result, our engineers have developed a system that’s guaranteed to deliver an incredible 99.999% of uptime. 4. Controlling cost-centres Getronics’ solution converts telephony into an application enabling Clinica de Girona to capture it for other applications. The system automatically calculates costs and enables each department to be billed based on usage, not estimates and guesswork. Delivering impact from day one Getronics has worked closely with Clinica de Girona to ensure the system and solution are effective from the minute the clinic opened for patients. We delivered the new communication system on time and within budget. The new communications system: includes over 600 extensions and fixed IP terminals connected and IP DECT wireless solution supporting 100 healthcare professionalsprovides a secure connection to the public network via IP link SIP standarddelivers access to applications for the patient care centre and unified communicationssupports secure remote workingenables smart processing and the automation of communication protocols for emergencies and medical processesensures accurate budget management and control applications. Future-proofing patient care The newly opened Clínica de Girona is a genuine 21st-century hospital. It’s built to the highest standards and incorporates the latest technologies to improve the patient experience and deliver the best outcomes. The new integrated communications solution, designed and delivered by Getronics, will ensure its ability to meet its challenges in the coming decades. Clinicians and patients at the new hospital benefit from: A single platform for multiple applications and communication protocols, connecting hybrid systems of all technologies. Integrating different systems and processes under a single management centre. Alarms and alerts assigned to specific business processes, including emergencies with medical action protocols. Wireless technology enables easier communication between clinicians within the hospital. Data can help accurately allocate costs and resources efficiently. The IP solution enables unified management while giving operational independence to third parties. Getronics and the Clínica de Girona continue to work together to deliver life-changing innovations."
AMRC Cymru: helping manufacturers to become net zero,https://www.getronics.com/amrc-cymru-helping-manufacturers-to-become-net-zero/,"‘Digital first’ is an ethos that defines both AMRC Cymru and Getronics. When Getronics became aware of AMRC Cymru’s goals to support manufacturing in transitioning towards net zero carbon, they approached them with a proposal. That proposal is a Proof of Concept that is now live at AMRC Cymru, showcasing how the active management of energy use in real-time is the first step to controlling and reducing towards net zero the use of greenhouse gases in a manufacturing business. Company profile AMRC Cymru is part of the University of Sheffield Advanced Manufacturing Research Centre (AMRC). This is a network of world-leading research and innovation centres working with manufacturing companies of any size from around the globe to develop and de-risk industry-transforming solutions. Locations The AMRC now employs over 500 highly qualified researchers and engineers from around the globe, on the Advanced Manufacturing Park and Sheffield Business Park in South Yorkshire, as well as in Broughton (North Wales) and Preston (Lancashire). Capabilities Machining, integrated manufacturing, composite manufacturing, castings, design & prototyping, structural testing, medical, additive manufacturing, microscopy, metrology and manufacturing Intelligence. Helping manufacturers to become net zero One of AMRC Cymru’s key objectives is to improve the sustainability of Welsh manufacturing. The drivers for change have never been more urgent: After decades of inaction, we are now in the midst of a climate crisisThe Government has committed the UK to a legally-binding target of Net Zero emissions by 2050The public and investment community are becoming far more aware of the sustainable credentials of all businesses and are making their buying choices based on them Climate change is a scientific fact and so businesses must respond to this imminently to reach Net Zero Manufacturing. It’s just the right thing to do! Combining this with the AMRC’s ‘digital first’ approach has resulted in a partnership with Getronics to deliver – Active Real-Time Energy Measurement. If you can’t measure you can’t control: Getronics has a strong track record of delivering and managing the integration of Operational Technology (OT) and Information Technology (IT) solutions. Our Energy Management solution sits within our Sustainable Manufacturing Integrated Solutions. Just taking the initial steps towards Proactive Energy Measurement & Management has been proven to save up to 25% in electricity and 50% in water usage. Taking real-time feeds from all Operational Technology is the starting point for measuring your energy usage and for taking steps to Net Zero Manufacturing. Step 1 – Set up the Monitoring Solution Our technicians can set up the IoT sensors or use existing integration solutions, PLC, Scada, network connectivity, etc. In any sized organisation the varieties of sensors and data feeds will be numerous. We can connect almost anything to anything. The level of granularity is the key, from site to individual machine the data must be made available in real-time. Step 2 – Creating the Dashboard Online dashboard from which you can run ‘what if’ scenarios and identify exactly where the big users of energy are. The visibility of OT also allows the user to actively manage those devices from remote, secure environments. Step 3 -Active Management Establishing Pro-Active management. It has been found that by just taking these steps you can reduce the energy consumed by up to 25%. Step 4 – Define Your Strategy Defining your strategic targets and goals can be a much more informed process if you use real-time data from your facilities. This will be a longer-term project, looking at renewable energy sources, swapping out high energy users, etc. We can help you with this step with our strategic consulting service. Digital Mapping of devices Once the device has been connected, it can be mapped across your facilities: The Future Any element of OT can be connected to the Getronics solution. HVAC, BMS, Lighting Systems, Security, Shopfloor systems, Robots, Conveyers, Water pumps, etc. Delivering a fully connected solution not only gives the ability to manage energy and waste but it can also be upgraded to include, condition monitoring, predictive maintenance, service management, etc. Automating the management and maintenance of the devices is the logical next step. We see the future scope of the AMRC Cymru project growing to prove the technology and demonstrate the multiple uses that real-time data can enable. ’We were very happy to support the proof of concept delivered by Getronics at AMRC Cymru. The work aligns perfectly with our goal of improving manufacturers’ productivity, performance and sustainability by incorporating innovative digital technologies.’ Andy Silcox, AMRC Cymru Research Director"
Ford: providing a wide range of Global Network Services,https://www.getronics.com/ford-providing-a-wide-range-of-global-network-services/,"Ford Europe has been an active Getronics customer for more than 40 years, beginning in 1980 with former Wang Global (which was acquired by Getronics in 1999). Flexibility, quality, and responsiveness are core to our DNA and these key factors enable Getronics to continue to build our success and provide assurance on a wide range of Global Network Services to our strategic global customer Ford. Case study details Solution Network Onsite Support, Project Implementation Services, Second and Third Level Remote Network Expertise Support. Company profile Ford Motor Company is a global automotive industry leader, that manufactures and distributes automobiles across six continents. With US$155.9 billion (2019) revenue, Ford’s market position is No 5th, with plants in over 20 countries. Locations Ford is headquartered in Dearborn Michigan, the USA with 190,000+ employees worldwide. They also have a presence in 200 countries around the world and direct operations in 77 countries. Challenge At the end of 2010, Ford started their search to find a global IT support provider, capable to deliver On-site Network Services for data centers, offices, warehouses, and critical production facilities mainly in North America and Europe. The highest required SLA is 24/7 2-hour resolution for critical sites with dedicated resources, followed by 4-hour resolution for Hubs and NBD for smaller local offices. Service needed to support a total of more than 15,000 network assets spread over 290+ sites are supported including DCs in North America, APAC, and Europe. The objective Ford Europe has been an active Getronics customer for more than 40 years, beginning in 1980 with former Wang Global (which was acquired by Getronics in 1999). Based on this long-standing, trusted, and proven relationship, Getronics was awarded the Maintenance Contract for Ford’s Global Network in 2011, covering more than 290 sites over a total of 26 countries in scope in Europe, the USA, and APAC. The scope of sites includes plants, warehouses, and offices as well as data centers and hubs. The contract had an initial term of three years, and due to Ford’s positive service experience, Getronics has continued to provide these services to Ford for almost 10 years maintaining their confidence and quality of services along the way. The global support services that Getronics provides to Ford under this contract comprise three functions: Hardware Break-Fix of supported devicesOn-site fault isolation supports network problemsAnd implementation of physical changes to network devices Services include both dedicated on-site resources in the major countries and per-incident dispatch resolution to local sites. Dispatch requests typically originate from Ford’s Global Service Desk if the network problem cannot be solved remotely. Additionally, Getronics, won a second global RFP in 2016 to deliver Network Planning and Implementation Services including Wi-Fi surveys in over 35 countries in all regions. Getronics was able to win this RFP due to consistent service delivery excellence in the previous years, with continuous green SLAs reported and no escalations. Along with the onsite services, Getronics expanded our service footprint within Ford in 2016 to include the delivery of a Remote Network Support contract to provide CNA support for Ford’s global layer 2 and layer 3 LAN and WAN across numerous technologies, as well as providing Network Management System (NMS) Tools to support their Global IP Network with a team of 10 people located at Ford’s offices in the UK and Germany forming the European arm of Ford’s follow-the-sun network support model. The Getronics solution A single global provider for all countriesIncreased efficiencies and functionalitiesCost savingsIncreased delivery performance with consistent qualityA single point of contact and contract for all their global entities and IT business needsAn ongoing governance model with a dedicated Getronics’ Service managementTeam interfacing and working hand-in-hand with Ford’s designated counterpartsFord can rely on Getronics’ expertise to ensure their networks are in good health, that any network issues are proactively managed and resolved, and that the critical network is available to Ford’s operationsOptimized IT-support experience and cooperation with the Ford internal teams across the globe Why Getronics? The international Getronics Global Services team which is also built upon our Global Workspace Alliance (GWA) framework and operating principles, worked as the pillar to understand Ford’s business objectives, build key relationships, and pro-actively define future IT requirements. Getronics provided the needed flexibility to Ford ensuring that our solutions were the best fit for their business. We are also working in close partnership with our specialized Network Services Partner in North America to fully support the requirements of Ford in this region. Our successful Global Service Delivery Model including seamless transition and competitive pricing convinced Ford that Getronics is the right partner to deliver these important services globally. Flexibility, quality, and responsiveness are core to our DNA and these key factors enable Getronics to continue to build our success and provide assurance to our strategic global customer Ford."
FROB: Finance and technology come together to deliver a personal service,https://www.getronics.com/finance-and-technology-come-together-to-deliver-a-personal-service-for-frob/,"While we initially only provided cloud services to FROB, Getronics now delivers a range of services in the areas of cloud, workspace, and security About FROB Fondo de Reestructuración Ordenada Bancaria (FROB) is a Spanish public entity in charge of restructuring credit institutions, investment firms, and banks. FROB was founded in 2009 in the wake of the global financial crisis with the remit of strengthening and stabilising the Spanish banking system. For example, in cases where a financial entity is failing (or likely to fail), there are no private solutions that could remedy the situation, and resolving the institution’s insolvency is deemed to be of public interest, then FROB will manage the execution of the resolution process. A long-standing relationship Getronics is best known as a technology provider and its customers recognise the company for the importance it places on human relationships. This is exemplified by the partnership that we have developed with FROB over many years. FROB has actually been working with some of our employees for more than 10 years. Although FROB was initially a customer of Colt, a UK-based technology supplier, Colt sold its cloud business to Getronics in 2016. Following the acquisition, much of the technology and many of the staff transferred from Colt to Getronics, allowing FROB to enjoy continuity of service. Expanding our services Although Getronics has maintained and strengthened the personal relationships that FROB has grown accustomed to over many years, we have also ramped up our service offering from a technology standpoint. While we initially only provided cloud services, Getronics now delivers a range of services in the areas of cloud, workspace and security. Our Microsoft 365 offering includes the Hybrid Exchange and SharePoint platforms, as well as OneDrive and Teams. Our workspace services, meanwhile, are available for all 50 users of FROB and encompass Intune Mobile Device Management (MDM) for desktops and mobile devices, Network Access Management (NAC), Remote L2 support and OnSite L1 support. Building trust Because of FROB’s work within the financial industry, the organisation frequently handles information of a sensitive nature. As such, it requires security services to be of the highest quality. FROB’s partnership with Getronics allows it to access services like Azure Information Protection (AIP), Advanced Threat Protection (ATP), Information Rights Management (IRM), firewalls, Cloud App Security and our anti-DDoS solution. In fact, FROB is Getronics’ first customer in Spain to benefit from our Security Operations Centre (SOC) services – reinforcing the close relationship between the two companies. Results and benefits Getronics is working with FROB to ensure that it can continue to deliver its services to the financial sector in Spain, providing added stability to an industry that is fundamental to a functioning economy. Some of the benefits of partnering with Getronics include: A single IT Infrastructure providerReduced operating costsReduced maintenance costsImproved customer end-user experienceIncreased security of FROB infrastructureStandardised services In addition, we provide FROB with a dedicated SDM and customer solution engineer, as well as a project officer that can provide technical updates and support digital transformation efforts. Getronics recently signed an extension of its contract with FROB in December 2020, and we look forward to working together for many more years to come."
